{
  "schemaVersion": "1",
  "type": "model-provider",
  "id": "meta",
  "name": "Meta Llama",
  "version": "1.0.0",
  "homepage": "https://www.llama.com",
  "description": "Meta's open-weight Llama models, served by many inference providers.",
  "docs": "https://www.llama.com/docs/",
  "models": [
    {
      "name": "llama-3.3-70b-instruct",
      "label": "Llama 3.3 70B Instruct",
      "description": "70B instruction-tuned model with quality near Llama 3.1 405B.",
      "context": 131072,
      "modalities": {
        "input": [
          "text"
        ],
        "output": [
          "text"
        ]
      },
      "capabilities": [
        "tools",
        "streaming"
      ]
    },
    {
      "name": "llama-3.1-405b-instruct",
      "label": "Llama 3.1 405B Instruct",
      "context": 131072,
      "modalities": {
        "input": [
          "text"
        ],
        "output": [
          "text"
        ]
      },
      "capabilities": [
        "tools",
        "streaming"
      ]
    },
    {
      "name": "llama-3.1-70b-instruct",
      "label": "Llama 3.1 70B Instruct",
      "context": 131072,
      "modalities": {
        "input": [
          "text"
        ],
        "output": [
          "text"
        ]
      },
      "capabilities": [
        "tools",
        "streaming"
      ]
    },
    {
      "name": "llama-3.1-8b-instruct",
      "label": "Llama 3.1 8B Instruct",
      "context": 131072,
      "modalities": {
        "input": [
          "text"
        ],
        "output": [
          "text"
        ]
      },
      "capabilities": [
        "tools",
        "streaming"
      ]
    },
    {
      "name": "llama-3.2-90b-vision-instruct",
      "label": "Llama 3.2 90B Vision Instruct",
      "context": 131072,
      "modalities": {
        "input": [
          "text",
          "image"
        ],
        "output": [
          "text"
        ]
      },
      "capabilities": [
        "tools",
        "vision",
        "streaming"
      ]
    },
    {
      "name": "llama-3.2-11b-vision-instruct",
      "label": "Llama 3.2 11B Vision Instruct",
      "context": 131072,
      "modalities": {
        "input": [
          "text",
          "image"
        ],
        "output": [
          "text"
        ]
      },
      "capabilities": [
        "tools",
        "vision",
        "streaming"
      ]
    }
  ]
}